{
  "version": 1,
  "updatedAt": "2026-08-10",
  "sources": [
    { "id": "existing-discovery-catalog", "title": "DefenseClaw AI discovery signatures", "url": "https://github.com/CSTG-yf/AgentScan-Tool/blob/main/internal/inventory/ai_signatures.json" },
    { "id": "codex", "title": "OpenAI Codex CLI", "url": "https://github.com/openai/codex" },
    { "id": "claude-code", "title": "Claude Code CLI reference", "url": "https://docs.anthropic.com/en/docs/claude-code/cli-usage" },
    { "id": "cursor", "title": "Cursor CLI overview", "url": "https://docs.cursor.com/en/cli/overview" },
    { "id": "gemini-cli", "title": "Gemini CLI", "url": "https://github.com/google-gemini/gemini-cli" },
    { "id": "copilot-cli", "title": "GitHub Copilot CLI reference", "url": "https://docs.github.com/en/copilot/reference/copilot-cli-reference/cli-command-reference" },
    { "id": "opencode", "title": "OpenCode CLI", "url": "https://opencode.ai/docs/cli/" },
    { "id": "openhands", "title": "OpenHands CLI command reference", "url": "https://docs.openhands.dev/openhands/usage/cli/command-reference" },
    { "id": "cline", "title": "Cline CLI reference", "url": "https://docs.cline.bot/cli/cli-reference" },
    { "id": "aider", "title": "Aider documentation", "url": "https://aider.chat/docs/" },
    { "id": "goose", "title": "Goose AI agent", "url": "https://block.github.io/goose/" },
    { "id": "qwen-code", "title": "Qwen Code overview", "url": "https://qwenlm.github.io/qwen-code-docs/en/" },
    { "id": "hermes", "title": "Hermes Agent CLI commands", "url": "https://hermes-agent.nousresearch.com/docs/reference/cli-commands" },
    { "id": "amazon-q", "title": "Amazon Q Developer command line lifecycle notice", "url": "https://docs.aws.amazon.com/amazonq/latest/qdeveloper-ug/command-line.html" },
    { "id": "agent-shell-capabilities", "title": "Gemini CLI shell command behavior", "url": "https://github.com/google-gemini/gemini-cli/blob/main/docs/reference/commands.md" }
  ],
  "agents": [
    { "id": "codex", "product": "OpenAI Codex", "vendor": "OpenAI", "kind": "terminal-agent", "launchCommands": ["codex"], "windowsProcessNames": ["codex.exe"], "relatedProcessNames": [], "guardRootEligible": true, "confidence": "high", "sourceRefs": ["codex"] },
    { "id": "claude-code", "product": "Claude Code", "vendor": "Anthropic", "kind": "terminal-agent", "launchCommands": ["claude"], "windowsProcessNames": ["claude.exe"], "relatedProcessNames": ["node.exe"], "guardRootEligible": true, "confidence": "high", "notes": "node.exe is only a host hint and requires command-line or installation-path evidence.", "sourceRefs": ["claude-code", "existing-discovery-catalog"] },
    { "id": "cursor", "product": "Cursor", "vendor": "Anysphere", "kind": "editor-agent", "launchCommands": ["cursor", "cursor-agent"], "windowsProcessNames": ["cursor.exe", "cursor-agent.exe"], "relatedProcessNames": [], "guardRootEligible": true, "confidence": "high", "sourceRefs": ["cursor"] },
    { "id": "windsurf", "product": "Windsurf", "vendor": "Cognition", "kind": "editor-agent", "launchCommands": ["windsurf"], "windowsProcessNames": ["windsurf.exe"], "relatedProcessNames": ["codeium.exe", "language_server_windows_x64.exe"], "guardRootEligible": true, "confidence": "high", "sourceRefs": ["existing-discovery-catalog"] },
    { "id": "gemini-cli", "product": "Gemini CLI", "vendor": "Google", "kind": "terminal-agent", "launchCommands": ["gemini"], "windowsProcessNames": ["gemini.exe"], "relatedProcessNames": ["node.exe"], "guardRootEligible": true, "confidence": "medium", "notes": "npm installations may appear as node.exe and need command-line evidence.", "sourceRefs": ["gemini-cli", "existing-discovery-catalog"] },
    { "id": "copilot-cli", "product": "GitHub Copilot CLI", "vendor": "GitHub", "kind": "terminal-agent", "launchCommands": ["copilot"], "windowsProcessNames": ["copilot.exe"], "relatedProcessNames": ["node.exe"], "guardRootEligible": true, "confidence": "medium", "sourceRefs": ["copilot-cli", "existing-discovery-catalog"] },
    { "id": "opencode", "product": "OpenCode", "vendor": "OpenCode", "kind": "terminal-agent", "launchCommands": ["opencode"], "windowsProcessNames": ["opencode.exe"], "relatedProcessNames": [], "guardRootEligible": true, "confidence": "high", "sourceRefs": ["opencode", "existing-discovery-catalog"] },
    { "id": "openhands", "product": "OpenHands", "vendor": "OpenHands", "kind": "agent-platform", "launchCommands": ["openhands"], "windowsProcessNames": ["openhands.exe"], "relatedProcessNames": ["python.exe", "docker.exe", "wsl.exe"], "guardRootEligible": true, "confidence": "medium", "notes": "OpenHands CLI on Windows is commonly run inside WSL; generic host processes are not exact Agent identities.", "sourceRefs": ["openhands", "existing-discovery-catalog"] },
    { "id": "cline", "product": "Cline", "vendor": "Cline", "kind": "terminal-agent", "launchCommands": ["cline"], "windowsProcessNames": ["cline.exe"], "relatedProcessNames": ["node.exe", "code.exe"], "guardRootEligible": true, "confidence": "medium", "sourceRefs": ["cline", "existing-discovery-catalog"] },
    { "id": "aider", "product": "Aider", "vendor": "Aider", "kind": "terminal-agent", "launchCommands": ["aider", "python -m aider"], "windowsProcessNames": ["aider.exe"], "relatedProcessNames": ["python.exe", "python3.exe"], "guardRootEligible": true, "confidence": "medium", "sourceRefs": ["aider", "existing-discovery-catalog"] },
    { "id": "goose", "product": "Goose", "vendor": "Agentic AI Foundation", "kind": "desktop-agent", "launchCommands": ["goose"], "windowsProcessNames": ["goose.exe"], "relatedProcessNames": [], "guardRootEligible": true, "confidence": "high", "sourceRefs": ["goose", "existing-discovery-catalog"] },
    { "id": "qwen-code", "product": "Qwen Code", "vendor": "Alibaba Cloud", "kind": "terminal-agent", "launchCommands": ["qwen"], "windowsProcessNames": ["qwen.exe"], "relatedProcessNames": ["node.exe"], "guardRootEligible": true, "confidence": "medium", "sourceRefs": ["qwen-code", "existing-discovery-catalog"] },
    { "id": "hermes", "product": "Hermes Agent", "vendor": "Nous Research", "kind": "desktop-agent", "launchCommands": ["hermes", "hermes chat"], "windowsProcessNames": ["hermes.exe"], "relatedProcessNames": ["python.exe"], "guardRootEligible": true, "confidence": "high", "sourceRefs": ["hermes", "existing-discovery-catalog"] },
    { "id": "openclaw", "product": "OpenClaw", "vendor": "DefenseClaw", "kind": "agent-platform", "launchCommands": ["openclaw"], "windowsProcessNames": ["openclaw.exe"], "relatedProcessNames": ["node.exe"], "guardRootEligible": true, "confidence": "high", "sourceRefs": ["existing-discovery-catalog"] },
    { "id": "zeptoclaw", "product": "ZeptoClaw", "vendor": "DefenseClaw", "kind": "agent-platform", "launchCommands": ["zeptoclaw"], "windowsProcessNames": ["zeptoclaw.exe"], "relatedProcessNames": [], "guardRootEligible": true, "confidence": "high", "sourceRefs": ["existing-discovery-catalog"] },
    { "id": "antigravity", "product": "Antigravity", "vendor": "Google", "kind": "editor-agent", "launchCommands": ["agy", "antigravity"], "windowsProcessNames": ["agy.exe", "antigravity.exe"], "relatedProcessNames": [], "guardRootEligible": true, "confidence": "medium", "sourceRefs": ["existing-discovery-catalog"] },
    { "id": "codeium", "product": "Codeium", "vendor": "Cognition", "kind": "editor-agent", "launchCommands": ["codeium"], "windowsProcessNames": ["codeium.exe"], "relatedProcessNames": ["language_server_windows_x64.exe"], "guardRootEligible": true, "confidence": "medium", "sourceRefs": ["existing-discovery-catalog"] },
    { "id": "amazon-q-legacy", "product": "Amazon Q Developer CLI (legacy)", "vendor": "Amazon Web Services", "kind": "terminal-agent", "launchCommands": ["q", "qchat"], "windowsProcessNames": ["q.exe", "qchat.exe"], "relatedProcessNames": [], "guardRootEligible": true, "confidence": "medium", "notes": "AWS documents that Q CLI has become Kiro CLI; retain these names for legacy-host visibility.", "sourceRefs": ["amazon-q", "existing-discovery-catalog"] }
  ],
  "commands": [
    { "id": "shell.cmd", "category": "shell", "commandNames": ["cmd"], "windowsProcessNames": ["cmd.exe"], "processVisibility": "exact-image", "riskLevel": "high", "recommendedAction": "review", "commonUses": ["运行批处理和 Windows 内置命令", "启动复合命令链"] },
    { "id": "shell.powershell", "category": "shell", "commandNames": ["powershell"], "windowsProcessNames": ["powershell.exe"], "processVisibility": "exact-image", "riskLevel": "high", "recommendedAction": "review", "commonUses": ["系统管理", "脚本执行", "下载和安装依赖"] },
    { "id": "shell.pwsh", "category": "shell", "commandNames": ["pwsh"], "windowsProcessNames": ["pwsh.exe"], "processVisibility": "exact-image", "riskLevel": "high", "recommendedAction": "review", "commonUses": ["跨平台 PowerShell 脚本", "构建和测试"] },
    { "id": "shell.wsl", "category": "shell", "commandNames": ["wsl"], "windowsProcessNames": ["wsl.exe"], "processVisibility": "exact-image", "riskLevel": "high", "recommendedAction": "review", "commonUses": ["进入 Linux 环境", "运行 Linux 工具链"] },
    { "id": "shell.bash", "category": "shell", "commandNames": ["bash", "sh"], "windowsProcessNames": ["bash.exe", "sh.exe"], "processVisibility": "exact-image", "riskLevel": "high", "recommendedAction": "review", "commonUses": ["运行 Shell 脚本", "组合文件和网络命令"] },
    { "id": "search.ripgrep", "category": "search", "commandNames": ["rg"], "windowsProcessNames": ["rg.exe"], "processVisibility": "exact-image", "riskLevel": "low", "recommendedAction": "observe", "commonUses": ["搜索源码内容", "定位符号和配置"] },
    { "id": "search.grep", "category": "search", "commandNames": ["grep"], "windowsProcessNames": ["grep.exe"], "processVisibility": "exact-image", "riskLevel": "low", "recommendedAction": "observe", "commonUses": ["过滤文本", "搜索日志和源码"] },